<!ELEMENT alumne (nom, cognom, telefon?, email?, modul+)>
<!ELEMENT nom (#PCDATA)>
<!ELEMENT cognom (#PCDATA)>
<!ELEMENT telefon (#PCDATA)>
<!ELEMENT email (#PCDATA)>
<!ELEMENT modul (#PCDATA)>
<!ATTLIST alumne id CDATA #REQUIRED
tipus (presencial | distancia) #REQUIRED>
